{
  "configSchema": "./config.schema.json",
  "consumes": [],
  "datasets": [
    {
      "id": "battery-office-east-village-v1",
      "reference": {
        "id": "battery-office-east-village-v1",
        "path": "../../data/autonomy/cooperation/battery-office-v1.json",
        "schemaId": "simulatte.cooperativeScenario.v1",
        "sha256": "5eb12f2a1c53a8630246c53f16b96218945e1becf611c7a53fee2c24c5625416"
      },
      "required": true
    }
  ],
  "defaultConfig": "./default-config.json",
  "entry": {
    "globalFactory": "SimulattePluginP2pDelivery",
    "integrity": "sha384-74ea48ad2b93bdc16cf14e4eada86695036f7e0163c86539a2ca2e0439229e4a01c8de9124bd32c6635b0e4207fa39c0",
    "path": "./index.js"
  },
  "extensionPoints": [
    "request",
    "settlement",
    "ui"
  ],
  "id": "p2p-delivery",
  "permissions": [
    "events.propose.v1",
    "language.parse.v1",
    "receipts.append.v1",
    "routing.contribute.v1",
    "state.reduce.v1",
    "ui.inspector.v1",
    "world.query.v1"
  ],
  "provides": [
    "fulfillment.delivery.v1",
    "settlement.delivery.v1"
  ],
  "receiptSchemas": [
    "simulatte.plugin.p2pDeliveryMatchReceipt.v1",
    "simulatte.plugin.p2pDeliverySettlement.v1"
  ],
  "resources": [
    {
      "integrity": "sha384-1f567fc532d56fea266a46ba561522d6f6f6ab40abf0d0a7b4ba70408ea93b83146fcb7c5195dd7ae7d4c7acde8f3284",
      "path": "./config.schema.json"
    },
    {
      "integrity": "sha384-f6eb547c956e4e0426c8a4b6e2efce0722a619a1eddfeab0469e501b16122978b8ace2f4d02ebece0c792ecad245da16",
      "path": "./contracts.js"
    },
    {
      "integrity": "sha384-d19d4793f852c7f0d48f705e0cf55a5d0319be9e32f20009b6a6b6ed6a11643224a9bb13c3406f8807c8b5d36591a7ab",
      "path": "./cooperative-engine.js"
    },
    {
      "integrity": "sha384-396f3c7241185c00f9b138528f99c742fc3171d75cf17ea6fe468907b10318e2594e36f235cbb2a03846bb6c927a4535",
      "path": "./default-config.json"
    },
    {
      "integrity": "sha384-cda0ec4208d5d4037c1305cb79d38083d1a140257696cbea8685ed3e41e83ad62fd472541abffcafa46e63fabd878924",
      "path": "./gpu-compute.js"
    },
    {
      "integrity": "sha384-f3e3e512341635415d4d0dad3f4890dac481a2062bfaf9fdffacee8025d52cd290bf5f935bc8d2bbe75fd425f6998ef1",
      "path": "./language-compiler.js"
    },
    {
      "integrity": "sha384-a76df8e0cedd29d7bb20bc1ff0752d1304776885f569d144f024cc883da6bfccdb9047ee0a5e7e9ea5bec4e7c7666046",
      "path": "./relay-planner.js"
    }
  ],
  "schema": "simulatte.pluginManifest.v1",
  "sdkVersion": 1,
  "version": "1.0.0"
}
